{
  "proposal_id": "f1211111-1111-4111-8111-111111111111",
  "assessment_draft_id": "f8121111-1111-4111-8111-111111111111",
  "title": "链表反转指针练习",
  "assessment_type": "practice",
  "instructions": "请选择正确答案。",
  "questions": [
    {
      "question_id": "fa111111-1111-4111-8111-111111111111",
      "question_type": "single_choice",
      "stem": "为什么必须先保存当前节点的后继节点？",
      "options": [
        {
          "option_id": "fb111111-1111-4111-8111-111111111111",
          "option_text": "避免修改 next 后丢失剩余链表"
        }
      ],
      "correct_answer": {
        "selected_option_ids": [
          "fb111111-1111-4111-8111-111111111111"
        ]
      },
      "score_points": 10,
      "scoring_rubric": [
        "选择正确选项得 10 分"
      ],
      "explanation": "修改当前节点 next 之后，若未保存后继节点，将无法继续遍历。",
      "evidence_ids": [
        "fd111111-1111-4111-8111-111111111111"
      ]
    }
  ],
  "total_score_points": 10,
  "pass_score_points": 6,
  "evidence_ids": [
    "fd111111-1111-4111-8111-111111111111"
  ],
  "confidence": 0.9
}
